{
  "protocol": "codex.top-level-task-receipt.v1",
  "orchestration_id": "substrate-a1-1d-5r3-mac-20260806-41f97e1c570d",
  "dispatch_nonce": "1b9fe0a5eee31553d83daa75ccdde591ea5a4b797a81f14c3f3d3d839bc9cd70",
  "increment": "AUX-R3-MAC-EVIDENCE-RECOVERY-R6",
  "status": "BLOCKED_SCOPE_EXPANSION",
  "increment_task": {
    "thread_id": "019fded7-05c4-7c61-9f7d-5fc456bcda6d",
    "host_id": "local"
  },
  "expected_base": {
    "commit": "a9626bc10a1737416c1d8f7f48630850118f3e6a",
    "tree": "3f7cdf20125a847a3dfaa472d3797759b5cf6737"
  },
  "blocker": {
    "summary": "R6 completion requires closed decoder, CLI, XPC/listener, and Linux guest-boundary symbols omitted from its named symbol fence.",
    "details": "The seven owning paths were authorized, but their existing request decoder, hidden control command, macOS XPC relay/listener operation matches, and Linux guest CLI/TTY/anchor boundaries were omitted from the named symbol fence. The task stopped before edits and stayed clean.",
    "required_authority": "Amend only the R6 symbol fence to name the exact closed two-session wiring and classify its two fixed tags as internal protocol discriminants.",
    "handoff_prompt": "Continue R6 in the same clean task/worktree under amendment 0035; do not begin evidence."
  },
  "next_increment": "EVIDENCE:R3-MAC-IMP-01"
}
