{
  "protocol": "codex.top-level-task-receipt.v1",
  "orchestration_id": "substrate-a1-1d-5r3-mac-20260806-41f97e1c570d",
  "dispatch_nonce": "7f33f40d8af93e12561b3b1e23fa38bfe3fca28e15c70f53caf6525dc85d68de",
  "increment": "AUX-R3-MAC-EVIDENCE-RECOVERY-R2",
  "status": "BLOCKED_PLATFORM_HANDOFF_REQUIRED",
  "increment_task": {
    "thread_id": "019fdcee-73e6-77a2-8a16-1d1c86223f9c",
    "host_id": "local"
  },
  "expected_base": {
    "commit": "bb098b6e265a4b6cadc4b7ca908c8b6ccf59f2b9",
    "tree": "688ae2860d99d6d5cf1019e0d3ba27c7cc26b6cc"
  },
  "blocker": {
    "summary": "R2 target compatibility proof is blocked only by absent cross-compilation toolchains on the macOS host.",
    "details": "The macOS host has no configured Windows MSVC SDK/C header environment: ring invokes cc with --target=x86_64-pc-windows-msvc and fails at fatal error: assert.h file not found; VCINSTALLDIR, CC_x86_64-pc-windows-msvc, and related target compiler variables are unset. cargo check --target x86_64-unknown-linux-gnu reaches ring and fails because x86_64-linux-gnu-gcc is not installed. No compiler/toolchain installation or substitute was attempted. The R2 source/test subject remains preserved unstaged; all macOS-owned deterministic checks passed and no review, commit, push, or successor dispatch occurred.",
    "required_authority": "Authorize disposable external Windows MSVC and Linux cross-compilation tooling without changing repository source or weakening the target-compile gates, then continue in the same task/worktree.",
    "handoff_prompt": "Preserve this existing worktree byte-for-byte. Do not clean, reset, restore, commit, or publish. Once the platform environment/authority is supplied, resume this same R2 subject under a new explicit continuation binding; reverify base/tree/diff/test/remote, rerun the failed target checks, then complete the remaining deterministic checks, fresh causal review, and publication. R3 was not dispatched."
  },
  "next_increment": "AUX-R3-MAC-EVIDENCE-RECOVERY-R3"
}
