{"protocol":"codex.top-level-task-receipt.v1","orchestration_id":"substrate-a1-1d-5r3-mac-20260806-41f97e1c570d","dispatch_nonce":"84392e6f217153abafdd033bf2b503ea9f901949c4ff34345ad93a2c06632faf","increment":"A1.1d-5R3-MAC","status":"LANDED_CLEAN","increment_task":{"thread_id":"019fd97a-3740-7261-a7e8-0008845709b5","host_id":"local"},"expected_base":{"commit":"270f6e55e1a94b7e2f9b2667e605980d2e50579c","tree":"acef6844c15d17aba8cfd18d2fc7ef88d9c3420b"},"landed":{"commit":"d8a65fc8890dd37584aaeac2984c906188e5f06e","tree":"d8f25cc993f264f0c67fe3e00180eb393e41b2e3","target_ref":"refs/heads/feat/internal-host-orchestrator-world-dispatch-bootstrap","live_remote":"d8a65fc8890dd37584aaeac2984c906188e5f06e"},"subject_fingerprint":"sha256:2f504d6b21503396af7b48276ec238de88f43f22dc4ac2c824131dce1252502c","changed_files":["crates/shell/src/execution/managed_lifecycle/macos_client.rs","crates/world-mac-lima/src/forwarding.rs","crates/world-mac-lima/src/lib.rs","llm-last-mile/runtime-refactor/00-README.md","llm-last-mile/runtime-refactor/02-seam-crosswalk.md","llm-last-mile/runtime-refactor/03-phase-slice-map.md","llm-last-mile/runtime-refactor/04-contracts-and-gates.md","llm-last-mile/runtime-refactor/05-debug-regression-ledger.md","llm-last-mile/runtime-refactor/review-control/r3-mac-review-allowlist-evidence.md","llm-last-mile/runtime-refactor/review-control/r3-mac-review-authority-security.md","llm-last-mile/runtime-refactor/review-control/r3-mac-review-cycle-record.json","llm-last-mile/runtime-refactor/review-control/r3-mac-review-lifecycle-convergence.md","scripts/mac/com.substrate.lifecycle.publisher.v1.plist","scripts/mac/lima-lifecycle.sh","scripts/mac/lima-stop.sh","scripts/mac/lima-warm.sh","scripts/mac/lima/units/substrate-world-service.socket","src/bin/substrate-lifecycle-macos.rs","tests/mac/lifecycle_r3.sh"],"review":{"packet_id":"A1.1d-5R3-MAC","record_path":"/Users/spensermcconnell/.codex/worktrees/a943/substrate/llm-last-mile/runtime-refactor/review-control/r3-mac-review-cycle-record.json","record_sha256":"sha256:f24c9fbf1c8257577b893dc264895c4da04b4d944cd97690d2f1290a3b048e44","validated":true,"terminal":"CLEAN","p1":0,"p2":0,"p3_p4_disposition":"No valid P3/P4 findings; inventory unchanged."},"verification":{"required_checks_passed":true,"allowlist_passed":true,"change_detection_passed":true,"checkout_clean":true,"ahead":0,"behind":0},"next_increment":"EVIDENCE:R3-MAC-IMP-01"}
