{
  "protocol": "codex.top-level-task-receipt.v1",
  "orchestration_id": "substrate-a1-1d-5r3-mac-20260806-41f97e1c570d",
  "dispatch_nonce": "e480367f5a8308d8ee73f97eb7734c80bd49e37a31c3a70a6e663668d622e70e",
  "increment": "AUX-R3-MAC-EVIDENCE-RECOVERY-R5",
  "status": "BLOCKED_CONTRADICTION",
  "increment_task": {
    "thread_id": "019fddab-1dd2-7570-9bd3-7f3841ce0283",
    "host_id": "local"
  },
  "expected_base": {
    "commit": "05d655fa1458a276f179d12057cbda772cc51eb6",
    "tree": "845694f733fccbfcd3703957bf4976da0ed59b40"
  },
  "blocker": {
    "summary": "The R5 FD3 bootstrap needs a minimal common authorization binding that R4 did not attach to PublisherBootstrapAuthorizationV1.",
    "details": "MacPublisherControlAuthorityV1 already exists and validates the fixed control image, digest, source and designated requirement, but PublisherBootstrapAuthorizationV1 cannot carry it. The preserved partial R5 subject is unpublished and review has not started.",
    "required_authority": "Authorize the exact common field/validation closure and two exact shell re-export paths inside R5.",
    "handoff_prompt": "Continue the preserved R5 task under amendment 0025 only; do not begin R6."
  },
  "next_increment": "AUX-R3-MAC-EVIDENCE-RECOVERY-R6"
}
