{
  "protocol": "codex.top-level-task-receipt.v1",
  "orchestration_id": "substrate-a1-1d-5r3-mac-20260806-41f97e1c570d",
  "dispatch_nonce": "49e8d36feff2e9ea0ef78ab92f14dc2680d3fe4e9ee2ffcd0badb8c1f113c41e",
  "increment": "AUX-R3-MAC-EVIDENCE-RECOVERY-R2",
  "status": "BLOCKED_CONTRADICTION",
  "increment_task": {
    "thread_id": "019fdce6-3860-7bb2-8099-20c870f8d3e2",
    "host_id": "local"
  },
  "expected_base": {
    "commit": "bb098b6e265a4b6cadc4b7ca908c8b6ccf59f2b9",
    "tree": "688ae2860d99d6d5cf1019e0d3ba27c7cc26b6cc"
  },
  "blocker": {
    "summary": "Unexpected tracked mutations outside the R2 allowlist.",
    "details": "After clean exact-base/remote/skill/donor preflight, GitNexus query reported degraded FTS. Per repository instruction I ran `npx gitnexus analyze`; it succeeded but automatically rewrote AGENTS.md and CLAUDE.md GitNexus metadata. Neither path is in R2's production, test, review-metadata, or permitted P3/P4 allowlist. The worktree is now dirty only at those two paths; no R2 code/test edit, test/build, install/native action, staging, commit, or publication occurred. I did not restore, checkout, reset, clean, rebase, or otherwise reconcile the bytes, preserving the blocked worktree.",
    "required_authority": "Explicit new authority is required to remediate the two generated tracked-file mutations (or to allocate a fresh exact-base R2 worktree), followed by a fresh identity/base binding. The current R2 contract prohibits reconciling this contradiction.",
    "handoff_prompt": "Continue only under fresh explicit authority. Rebind task identity/worktree/base/tree/remote. First independently inspect the two-path generated diff and decide whether exact restoration of AGENTS.md and CLAUDE.md is authorized; otherwise provision a fresh worktree at bb098b6e265a4b6cadc4b7ca908c8b6ccf59f2b9 / 688ae2860d99d6d5cf1019e0d3ba27c7cc26b6cc. Do not use the donor as a baseline or mutate protected checkouts. Reconfirm live remote target. Only then restart R2 pre-edit GitNexus analysis with an index-only/no-file-injection method or user-approved exception. Do not begin R3-R6, installation, or native evidence."
  }
}
